{
  "schemaVersion": 1,
  "workId": "review-remediation",
  "source": "review",
  "target": "implement",
  "reason": "Attempt-1 independent review found RR-002 immediate integrated-artifact enforcement and RR-003 validation-evidence provenance gaps",
  "evidence": {
    "kind": "review",
    "review": {
      "schemaVersion": 1,
      "workId": "review-remediation",
      "attempt": 1,
      "reviewer": "ways-reviewer",
      "digest": "c8233476d3b058f4a58bbeb29edc3ebbf0b14953ab574a288f0f6e3f2a18d937",
      "verdict": "fail",
      "findings": [
        {
          "id": "RR-002",
          "severity": "high",
          "summary": "Integrated delegated task commits can mutate prior-attempt artifacts and still pass implementation certification; detection is deferred to history checking.",
          "disposition": "open"
        },
        {
          "id": "RR-003",
          "severity": "high",
          "summary": "Validation remediation evidence remains forgeable because its digest marker and formatted failure entries are self-attested rather than linked to a deterministically verifiable failed gate.",
          "disposition": "open"
        }
      ]
    }
  },
  "priorCheckpoint": "7ff3093bd4ea7c446c3da3bb3b833ec9e28cd185",
  "attempt": 2,
  "timestamp": "2026-09-04T06:20:49.836Z"
}
